results/scores.csv

date,version,model,rmse_mean,rmse_std,config
30 14:40,v_ensemble,weighted_average,28297.205226088696,0.0,"{'ridge': 0.15, 'catboost': 0.5, 'xgboost': 0.35}"
30 14:40,v_ensemble,voting,29147.608864112808,0.0,simple average
30 14:40,v_ensemble,stacking,29881.827668777165,0.0,ridge
30 14:43,v_ensemble,weighted_average,0.1236497168333072,0.0,"{'ridge': 0.15, 'catboost': 0.5, 'xgboost': 0.35}"
30 14:43,v_ensemble,voting,0.1235833936129028,0.0,simple average
30 14:43,v_ensemble,stacking,0.1246429807312797,0.0,ridge
30 14:44,v_ensemble,weighted_average,0.1236497168333072,0.0,"{'ridge': 0.15, 'catboost': 0.5, 'xgboost': 0.35}"
30 14:44,v_ensemble,voting,0.1235833936129028,0.0,simple average
30 14:44,v_ensemble,stacking,0.1246429807312797,0.0,ridge
30 14:46,v_ensemble,ridge,0.1342900021495535,0.0213916134058796,"{'enabled': True, 'alpha': 1.0, 'max_iter': 1000, 'preprocessing': 'standart'}"
30 14:46,v_ensemble,knn,0.1763116469976024,0.0118091253266065,"{'enabled': True, 'n_neighbors': 5, 'weights': 'distance', 'metric': 'minkowski', 'preprocessing': 'standart'}"
30 14:46,v_ensemble,decision_tree,0.1987145571905412,0.0110403324152715,"{'enabled': True, 'max_depth': 5, 'preprocessing': 'tree'}"
30 14:46,v_ensemble,random_forest,0.1457769755073828,0.0185914665186885,"{'enabled': True, 'n_estimators': 300, 'max_depth': 8, 'min_samples_split': 5, 'random_state': 42, 'preprocessing': 'tree'}"
30 14:46,v_ensemble,catboost,0.1242615557940622,0.013731109525931,"{'enabled': True, 'iterations': 1000, 'learning_rate': 0.05, 'l2_leaf_reg': 3.0, 'depth': 6, 'loss_function': 'RMSE', 'eval_metric': 'RMSE', 'drop_columns': ['Id']}"
30 14:46,v_ensemble,xgboost,0.1326568244655115,0.0183549270866623,"{'enabled': True, 'n_estimators': 1000, 'max_depth': 4, 'learning_rate': 0.03, 'subsample': 0.8, 'colsample_bytree': 0.7, 'min_child_weight': 1, 'eval_metric': 'rmse', 'preprocessing': 'tree'}"
25 19:40,v_ensemble,mlp,0.2143107560725178,0.0301389441636699,"{'enabled': True, 'hidden_layer_sizes': [128, 64], 'activation': 'relu', 'solver': 'adam', 'learning_rate_init': 0.001, 'batch_size': 32, 'max_iter': 400, 'alpha': 0.0001, 'early_stopping': True, 'preprocessing': 'standart'}"
25 19:40,v_ensemble,ridge,0.1342900021495535,0.0213916134058796,"{'enabled': True, 'alpha': 1.0, 'max_iter': 1000, 'preprocessing': 'standart'}"
25 19:40,v_ensemble,knn,0.1763116469976024,0.0118091253266065,"{'enabled': True, 'n_neighbors': 5, 'weights': 'distance', 'metric': 'minkowski', 'preprocessing': 'standart'}"
25 19:40,v_ensemble,decision_tree,0.1987145571905412,0.0110403324152715,"{'enabled': True, 'max_depth': 5, 'preprocessing': 'tree'}"
25 19:40,v_ensemble,random_forest,0.1456893320126183,0.0183948760598793,"{'enabled': True, 'n_estimators': 300, 'max_depth': 8, 'min_samples_split': 5, 'random_state': 42, 'preprocessing': 'tree'}"
25 19:40,v_ensemble,catboost,0.1242615557940622,0.013731109525931,"{'enabled': True, 'iterations': 1000, 'learning_rate': 0.05, 'l2_leaf_reg': 3.0, 'depth': 6, 'loss_function': 'RMSE', 'eval_metric': 'RMSE', 'drop_columns': ['Id']}"
25 19:40,v_ensemble,xgboost,0.1326568244655115,0.0183549270866623,"{'enabled': True, 'n_estimators': 1000, 'max_depth': 4, 'learning_rate': 0.03, 'subsample': 0.8, 'colsample_bytree': 0.7, 'min_child_weight': 1, 'eval_metric': 'rmse', 'preprocessing': 'tree'}"
25 19:44,v_ensemble,mlp,0.1819335275105211,0.0134174700160877,"{'enabled': True, 'hidden_layer_sizes': [64, 32], 'activation': 'relu', 'solver': 'adam', 'learning_rate_init': 0.001, 'batch_size': 32, 'max_iter': 400, 'alpha': 0.001, 'early_stopping': True, 'preprocessing': 'standart'}"
25 19:44,v_ensemble,ridge,0.1342900021495535,0.0213916134058796,"{'enabled': True, 'alpha': 1.0, 'max_iter': 1000, 'preprocessing': 'standart'}"
25 19:44,v_ensemble,knn,0.1763116469976024,0.0118091253266065,"{'enabled': True, 'n_neighbors': 5, 'weights': 'distance', 'metric': 'minkowski', 'preprocessing': 'standart'}"
25 19:44,v_ensemble,decision_tree,0.1987145571905412,0.0110403324152715,"{'enabled': True, 'max_depth': 5, 'preprocessing': 'tree'}"
25 19:44,v_ensemble,random_forest,0.1456893320126183,0.0183948760598793,"{'enabled': True, 'n_estimators': 300, 'max_depth': 8, 'min_samples_split': 5, 'random_state': 42, 'preprocessing': 'tree'}"
25 19:44,v_ensemble,catboost,0.1242615557940622,0.013731109525931,"{'enabled': True, 'iterations': 1000, 'learning_rate': 0.05, 'l2_leaf_reg': 3.0, 'depth': 6, 'loss_function': 'RMSE', 'eval_metric': 'RMSE', 'drop_columns': ['Id']}"
25 19:44,v_ensemble,xgboost,0.1326568244655115,0.0183549270866623,"{'enabled': True, 'n_estimators': 1000, 'max_depth': 4, 'learning_rate': 0.03, 'subsample': 0.8, 'colsample_bytree': 0.7, 'min_child_weight': 1, 'eval_metric': 'rmse', 'preprocessing': 'tree'}"
25 19:46,v_ensemble,mlp,0.2121105772042323,0.035179142262723,"{'enabled': True, 'hidden_layer_sizes': [128, 64], 'activation': 'relu', 'solver': 'adam', 'learning_rate_init': 0.0005, 'batch_size': 32, 'max_iter': 400, 'alpha': 0.01, 'early_stopping': True, 'preprocessing': 'standart'}"
25 19:46,v_ensemble,ridge,0.1342900021495535,0.0213916134058796,"{'enabled': True, 'alpha': 1.0, 'max_iter': 1000, 'preprocessing': 'standart'}"
25 19:46,v_ensemble,knn,0.1763116469976024,0.0118091253266065,"{'enabled': True, 'n_neighbors': 5, 'weights': 'distance', 'metric': 'minkowski', 'preprocessing': 'standart'}"
25 19:46,v_ensemble,decision_tree,0.1987145571905412,0.0110403324152715,"{'enabled': True, 'max_depth': 5, 'preprocessing': 'tree'}"
25 19:46,v_ensemble,random_forest,0.1456893320126183,0.0183948760598793,"{'enabled': True, 'n_estimators': 300, 'max_depth': 8, 'min_samples_split': 5, 'random_state': 42, 'preprocessing': 'tree'}"
25 19:46,v_ensemble,catboost,0.1242615557940622,0.013731109525931,"{'enabled': True, 'iterations': 1000, 'learning_rate': 0.05, 'l2_leaf_reg': 3.0, 'depth': 6, 'loss_function': 'RMSE', 'eval_metric': 'RMSE', 'drop_columns': ['Id']}"
25 19:46,v_ensemble,xgboost,0.1326568244655115,0.0183549270866623,"{'enabled': True, 'n_estimators': 1000, 'max_depth': 4, 'learning_rate': 0.03, 'subsample': 0.8, 'colsample_bytree': 0.7, 'min_child_weight': 1, 'eval_metric': 'rmse', 'preprocessing': 'tree'}"
25 19:48,v_ensemble,mlp,0.2361568910496418,0.0259886017904556,"{'enabled': True, 'hidden_layer_sizes': [256, 128, 64], 'activation': 'relu', 'solver': 'adam', 'learning_rate_init': 0.0005, 'batch_size': 32, 'max_iter': 400, 'alpha': 0.001, 'early_stopping': True, 'preprocessing': 'standart'}"
25 19:48,v_ensemble,ridge,0.1342900021495535,0.0213916134058796,"{'enabled': True, 'alpha': 1.0, 'max_iter': 1000, 'preprocessing': 'standart'}"
25 19:48,v_ensemble,knn,0.1763116469976024,0.0118091253266065,"{'enabled': True, 'n_neighbors': 5, 'weights': 'distance', 'metric': 'minkowski', 'preprocessing': 'standart'}"
25 19:48,v_ensemble,decision_tree,0.1987145571905412,0.0110403324152715,"{'enabled': True, 'max_depth': 5, 'preprocessing': 'tree'}"
25 19:48,v_ensemble,random_forest,0.1456893320126183,0.0183948760598793,"{'enabled': True, 'n_estimators': 300, 'max_depth': 8, 'min_samples_split': 5, 'random_state': 42, 'preprocessing': 'tree'}"
25 19:48,v_ensemble,catboost,0.1242615557940622,0.013731109525931,"{'enabled': True, 'iterations': 1000, 'learning_rate': 0.05, 'l2_leaf_reg': 3.0, 'depth': 6, 'loss_function': 'RMSE', 'eval_metric': 'RMSE', 'drop_columns': ['Id']}"
25 19:48,v_ensemble,xgboost,0.1326568244655115,0.0183549270866623,"{'enabled': True, 'n_estimators': 1000, 'max_depth': 4, 'learning_rate': 0.03, 'subsample': 0.8, 'colsample_bytree': 0.7, 'min_child_weight': 1, 'eval_metric': 'rmse', 'preprocessing': 'tree'}"
25 19:50,v_ensemble,mlp,0.18022753052507987,0.025061177572597564,"{'enabled': True, 'hidden_layer_sizes': [64, 32], 'activation': 'relu', 'solver': 'adam', 'learning_rate_init': 0.005, 'batch_size': 32, 'max_iter': 400, 'alpha': 0.001, 'early_stopping': True, 'preprocessing': 'standart'}"
25 19:50,v_ensemble,ridge,0.13429000214955353,0.02139161340587964,"{'enabled': True, 'alpha': 1.0, 'max_iter': 1000, 'preprocessing': 'standart'}"
25 19:50,v_ensemble,knn,0.1763116469976024,0.011809125326606542,"{'enabled': True, 'n_neighbors': 5, 'weights': 'distance', 'metric': 'minkowski', 'preprocessing': 'standart'}"
25 19:50,v_ensemble,decision_tree,0.19871455719054126,0.011040332415271525,"{'enabled': True, 'max_depth': 5, 'preprocessing': 'tree'}"
25 19:50,v_ensemble,random_forest,0.14568933201261838,0.01839487605987937,"{'enabled': True, 'n_estimators': 300, 'max_depth': 8, 'min_samples_split': 5, 'random_state': 42, 'preprocessing': 'tree'}"
25 19:50,v_ensemble,catboost,0.1242615557940622,0.01373110952593109,"{'enabled': True, 'iterations': 1000, 'learning_rate': 0.05, 'l2_leaf_reg': 3.0, 'depth': 6, 'loss_function': 'RMSE', 'eval_metric': 'RMSE', 'drop_columns': ['Id']}"
25 19:50,v_ensemble,xgboost,0.13265682446551158,0.01835492708666235,"{'enabled': True, 'n_estimators': 1000, 'max_depth': 4, 'learning_rate': 0.03, 'subsample': 0.8, 'colsample_bytree': 0.7, 'min_child_weight': 1, 'eval_metric': 'rmse', 'preprocessing': 'tree'}"

README.md

## Requirements

catboost 0.1243
xgboost 0.1327
ridge 0.1343
random_forest 0.1457
knn 0.1763
mlp 0.1802
decision_tree 0.1987